{"administrator_acceptance":"PENDING","authorization_id":"V2_01_IMPLEMENTATION","authorization_kind":"section_implementation","base_checkpoint":"a1dd46bef5e83eac9b8860aa6a9dfd0e3dea615a","branch":"feature/v2-continuity-onboarding","commit_sequence":[{"id":"A1","message":"chore(v2): activate V2-01 implementation","path_class":"root_control"},{"id":"P1","message":"feat(v2): implement architecture compatibility contract","path_class":"reusable_product"},{"id":"V1","message":"chore(v2): record V2-01 implementation verification","path_class":"root_control"}],"exact_file_scope":["VERSION","system-manifest.json","docs/Architecture.md","specs/v2-architecture-compatibility.md","specs/v2-compatibility-profile.json","schemas/bce/2.0.0/bce-compatibility-profile.schema.json","tools/validate_floppy.py","tools/floppyctl.py","tests/test_v2_compatibility.py","tests/test_tooling.py","tests/test_validated_boot_package.py"],"forbidden_side_effects":["administrator result acceptance","V2-01 closeout","V2-02 or later implementation","migration","main modification","integration","merge","tag","release","force push","rebase","history rewrite","modification of schemas/bce/1.0.0/*","modification of schemas/bce/1.1.0/*","modification of schemas/bce/1.2.0/*","modification of project-seed/.floppy/*"],"human_authority":{"actor":"Alva Roberts","decision":"AUTHORIZE V2-01 IMPLEMENTATION FROM ACCEPTED V2-01 BASE a1dd46bef5e83eac9b8860aa6a9dfd0e3dea615a ON feature/v2-continuity-onboarding IN D:\\A\\Floppy-V2 WITH AUTHORIZATION V2_01_IMPLEMENTATION AND REPOSITORY WRITER V2_01_WORKING_MODEL; AUTHORIZE THE A1 ACTIVATION CONTROL COMMIT, EXACTLY ONE P1 REUSABLE-PRODUCT COMMIT LIMITED TO THE 11 PATHS IN THIS PACKAGE, THE SPECIFIED FOCUSED VALIDATION, SOURCE VALIDATION, TRACKED-JSON VALIDATION, ONE COMPLETE REPOSITORY TEST SUITE, AND THE V1 IMPLEMENTATION-COMPLETION/VERIFICATION CONTROL COMMIT; DO NOT AUTHORIZE ADMINISTRATOR RESULT ACCEPTANCE, CLOSEOUT, V2-02 OR LATER IMPLEMENTATION, MIGRATION, MAIN MODIFICATION, INTEGRATION, MERGE, TAG, RELEASE, FORCE PUSH, REBASE, OR HISTORY REWRITE. STOP AFTER THE VERIFIED V2-01 RESULT IS RECORDED AND RETURN THE EXACT A1, P1, AND V1 COMMITS/TREES AND VALIDATION EVIDENCE FOR ADMINISTRATOR REVIEW.","issued_explicitly":true},"integration":"NOT AUTHORIZED","later_section_authority":"NOT AUTHORIZED","push_boundary":{"branch":"feature/v2-continuity-onboarding","force_push":false,"permitted":true},"repository":"TemperalTemplar/floppy-project-interaction-system","required_validation":["D:\\A\\Tools\\Python313\\python.exe -B tools\\validate_floppy.py . --mode source","D:\\A\\Tools\\Python313\\python.exe -B -m pytest -q tests\\test_v2_compatibility.py tests\\test_tooling.py tests\\test_validated_boot_package.py tests\\test_project_provisioning.py tests\\test_final_closure.py tests\\test_export_integrity.py tests\\test_orchestrator_registry.py","D:\\A\\Tools\\Python313\\python.exe -B -m pytest -q","Parse every tracked *.json file successfully."],"section":null,"section_closeout":"NOT AUTHORIZED","source_version":"1.0.0","worktree":"D:\\A\\Floppy-V2"}
