{
  "authorization_id": "FS_02_IMPLEMENTATION",
  "authorization_kind": "section_implementation",
  "section": "FS-02",
  "human_authority": {
    "actor": "administrator",
    "decision": "Authorize bounded FS-02 reusable-product implementation.",
    "issued_explicitly": true
  },
  "repository": "TemperalTemplar/floppy-project-interaction-system",
  "base_checkpoint": "3f75d97b29abddd9684cb0d428b4770c9c4fd622",
  "source_version": "0.4.1-dev",
  "branch": "feature/fs-02-normative-bce-schemas",
  "worktree": "D:\\A\\Floppy\\floppy-fs-02-normative-bce-schemas",
  "exact_file_scope": [
    "schemas/bce/1.0.0/bce-lifecycle-state.schema.json",
    "schemas/bce/1.0.0/bce-work-authorization.schema.json",
    "schemas/bce/1.0.0/bce-lifecycle-transition.schema.json",
    "tools/validate_floppy.py",
    "system-manifest.json",
    "tests/test_bce_schemas.py",
    "tests/fixtures/bce-schemas/1.0.0/valid/lifecycle-state.json",
    "tests/fixtures/bce-schemas/1.0.0/invalid/lifecycle-state.json",
    "tests/fixtures/bce-schemas/1.0.0/valid/work-authorization.json",
    "tests/fixtures/bce-schemas/1.0.0/invalid/work-authorization.json",
    "tests/fixtures/bce-schemas/1.0.0/valid/lifecycle-transition.json",
    "tests/fixtures/bce-schemas/1.0.0/invalid/lifecycle-transition.json"
  ],
  "required_validation": [
    "Verify Draft 2020-12 jsonschema support.",
    "Run tests/test_bce_schemas.py.",
    "Run full test_*.py discovery.",
    "Run git diff --check.",
    "Verify the exact twelve reusable-product paths.",
    "Verify preserved artifacts remain unchanged."
  ],
  "commit_sequence": [
    {
      "id": "P1",
      "message": "feat(fs-02): add normative BCE schema contracts",
      "path_class": "reusable_product"
    },
    {
      "id": "P2",
      "message": "test(fs-02): register and validate normative BCE schemas",
      "path_class": "reusable_product"
    }
  ],
  "push_boundary": {
    "permitted": false,
    "branch": null,
    "force_push": false
  },
  "forbidden_side_effects": [
    "changes outside the twelve authorized reusable-product paths",
    "root-control changes during P1 or P2",
    "push",
    "integration or merge",
    "tag or release",
    "migration",
    "production changes",
    "FS-03"
  ],
  "administrator_acceptance": "PENDING",
  "section_closeout": "NOT AUTHORIZED",
  "integration": "NOT AUTHORIZED",
  "later_section_authority": "NOT AUTHORIZED"
}
